{
  "$schema": "../../schemas/variant-catalog.schema.json",
  "catalogVersion": "1.0",
  "generatedBy": "manual research（spec Post-Stability Phase F，2026-09-24）",
  "note": "流派差異維度盤點。每列描述：ZiWeiJS 目前以何種機制表達該差異（profile 欄位 / ruleOverrides variant / 尚未建模）。未建模者一律附 Research ID，不得直接改 canonical。新增 variant 一律走 Profile → ruleOverrides → Variant Rule，禁止 if (profile === ...)。",
  "dimensions": [
    {
      "dimensionId": "VAR.YEAR_BOUNDARY",
      "name": { "zh-TW": "年界（年柱換年）", "en": "Year boundary policy" },
      "status": "modeled",
      "mechanism": "both",
      "profileFields": ["yearBoundaryPolicy"],
      "profiles": ["canonical", "lichun"],
      "rules": ["ZW.CALC.CALENDAR.YEAR_BOUNDARY.001"],
      "variants": ["ZW.CALC.CALENDAR.YEAR_BOUNDARY.V001"],
      "coveredBy": ["calendar-engine-resolved-year", "profiles/lichun.json"],
      "researchIds": ["RSH.CALENDAR.YEAR_BOUNDARY"],
      "externalObservation": "多數排盤軟體採農曆正月初一換年；部分流派採立春。",
      "gap": null,
      "nextAction": null,
      "ownerReviewRequired": false
    },
    {
      "dimensionId": "VAR.MONTH_BOUNDARY",
      "name": { "zh-TW": "月界（流月換月）", "en": "Month boundary policy" },
      "status": "not-modeled",
      "mechanism": "none",
      "profileFields": [],
      "profiles": [],
      "rules": ["ZW.CALC.PERIOD.LIUYUE.001"],
      "variants": [],
      "coveredBy": [],
      "researchIds": ["RSH.PERIOD.MONTH_BOUNDARY"],
      "externalObservation": "流月有以農曆月界、亦有以節氣（斗君＋節氣月）起算者；本引擎現以農曆月（斗君起正月）計。",
      "gap": "尚無 monthBoundaryPolicy profile 欄位，無法表達節氣月界流派。",
      "nextAction": "先登錄研究（RSH.PERIOD.MONTH_BOUNDARY），取得可引用來源後再考慮以 profile 欄位 + variant 表達。",
      "ownerReviewRequired": true
    },
    {
      "dimensionId": "VAR.LATE_ZI",
      "name": { "zh-TW": "晚子時（23 時換日）", "en": "Late Zi-hour policy" },
      "status": "partially-modeled",
      "mechanism": "profile-field",
      "profileFields": ["dayBoundary"],
      "profiles": ["canonical", "traditional-zi"],
      "rules": ["ZW.CALC.CALENDAR.GANZHI.001", "ZW.CALC.CALENDAR.SOLAR_LUNAR.001"],
      "variants": [],
      "coveredBy": ["dayBoundary: midnight | zi-hour", "fixtures/golden/golden-hour-23-latezi.json"],
      "researchIds": ["RSH.CALENDAR.LATE_ZI_POLICY"],
      "externalObservation": "23:00 出生者是否算次日子時（早子/晚子）各家不同：iztro 預設 forward（晚子算次日），本引擎 canonical 為午夜制並提供 traditional-zi（子初換日）。",
      "gap": "「晚子時是否獨立為不換日之子時」尚未以 variant 規則表達，目前僅能以 dayBoundary profile 欄位切換整體換日策略。",
      "nextAction": "若需支援『晚子不換日但時柱歸子』之混合流派，應新增 profile 欄位（lateZiPolicy）+ variant，而非新增 if 分支。",
      "ownerReviewRequired": true
    },
    {
      "dimensionId": "VAR.LEAP_MONTH",
      "name": { "zh-TW": "閏月", "en": "Leap month policy" },
      "status": "partially-modeled",
      "mechanism": "profile-field",
      "profileFields": ["leapMonthPolicy"],
      "profiles": ["canonical", "traditional-zi", "true-solar", "lichun", "school-zhongzhou", "school-ma-hu"],
      "rules": ["ZW.CALC.CALENDAR.SOLAR_LUNAR.001"],
      "variants": [],
      "coveredBy": ["leapMonthPolicy enum: same-as-normal | next-month | mid-month（split 未實作）"],
      "researchIds": ["RSH.LEAP_MONTH_SPLIT"],
      "externalObservation": "閏月生有『視同下月』『視同本月』『月中分界（前半月本月、後半月下月）』『整月拆分』等流派。",
      "gap": "`split`（整月拆分）尚未實作；`mid-month` 僅以日期分界近似。",
      "nextAction": "先確認 split 流派之可引用來源，再實作 executor 分支（由 profile 欄位驅動）。",
      "ownerReviewRequired": true
    },
    {
      "dimensionId": "VAR.BRIGHTNESS",
      "name": { "zh-TW": "廟旺利陷", "en": "Brightness table profile" },
      "status": "partially-modeled",
      "mechanism": "rule-variant",
      "profileFields": [],
      "profiles": ["school-zhongzhou"],
      "rules": ["ZW.CALC.DIGNITY.BRIGHTNESS.001"],
      "variants": ["ZW.CALC.DIGNITY.BRIGHTNESS.V001"],
      "coveredBy": ["tables/dignity/brightness.json", "variant patch: 天同/巨門 巳亥"],
      "researchIds": ["RSH.BRIGHTNESS_TABLE"],
      "externalObservation": "各流派廟旺表差異大（尤以天同、巨門、太陰、七殺）。iztro 亮度表亦與本引擎 canonical 有別。",
      "gap": "variant 僅涵蓋 天同/巨門 巳亥兩宮（非整套表），且目前無 profile 選用該 variant（僅能經 ruleOverrides 手動指定）。",
      "nextAction": "若採用某流派整表，應新增 variant 規則載入替代表（tableRef 指向 variant 表檔），不可零星補丁。",
      "ownerReviewRequired": true
    },
    {
      "dimensionId": "VAR.SIHUA_TABLE",
      "name": { "zh-TW": "四化表", "en": "Sihua table profile" },
      "status": "modeled",
      "mechanism": "both",
      "profileFields": ["ruleOverrides"],
      "profiles": ["canonical", "school-zhongzhou"],
      "rules": ["ZW.CALC.SIHUA.TABLE.001", "ZW.CALC.SIHUA.NATAL.001"],
      "variants": ["ZW.CALC.SIHUA.TABLE.V001", "ZW.CALC.SIHUA.NATAL.V001"],
      "coveredBy": ["tables/transformations/sihua.json", "庚干 天同化科/天府化科 差異"],
      "researchIds": [],
      "externalObservation": "庚干四化（天同/太陰、天相/天府）為最常見流派差異；本引擎以 variant 表達。",
      "gap": null,
      "nextAction": null,
      "ownerReviewRequired": false
    },
    {
      "dimensionId": "VAR.TIANMA",
      "name": { "zh-TW": "天馬", "en": "Tian Ma placement profile" },
      "status": "not-modeled",
      "mechanism": "none",
      "profileFields": [],
      "profiles": [],
      "rules": ["ZW.CALC.STAR.YEARBRANCH_AUX.001"],
      "variants": [],
      "coveredBy": ["tables/stars/aux-tables#byYearBranch 單一表"],
      "researchIds": ["RSH.STAR.TIANMA_SCHOOL"],
      "externalObservation": "天馬有以年支三合（寅午戌在申…）與以月支安之兩說，另有『天馬隨祿存』流派。",
      "gap": "無 variant 表；目前僅年支三合一法。",
      "nextAction": "取得可引用來源後，以 variant 規則 + 替代表實作月支或隨祿存版本。",
      "ownerReviewRequired": true
    },
    {
      "dimensionId": "VAR.TIANKONG",
      "name": { "zh-TW": "天空", "en": "Tian Kong placement profile" },
      "status": "not-modeled",
      "mechanism": "none",
      "profileFields": [],
      "profiles": [],
      "rules": ["ZW.CALC.STAR.YEARBRANCH_AUX.001"],
      "variants": [],
      "coveredBy": ["天空＝地劫對宮（亥上起子順安劫，逆向為天空）"],
      "researchIds": ["RSH.STAR.TIANKONG_SCHOOL"],
      "externalObservation": "天空有『對宮地劫』與『年支起子逆行』兩說（部分軟體與地空混用）。",
      "gap": "無 variant；目前採對宮地劫法。",
      "nextAction": "建立 variant 表以支援年支起子版本；須先取得來源。",
      "ownerReviewRequired": true
    },
    {
      "dimensionId": "VAR.VOID_STAR",
      "name": { "zh-TW": "截空 / 旬空", "en": "Void star placement profile" },
      "status": "not-modeled",
      "mechanism": "none",
      "profileFields": [],
      "profiles": [],
      "rules": ["ZW.CALC.STAR.YEARSTEM_AUX.001"],
      "variants": [],
      "coveredBy": ["截空（年干）＋旬中空亡（年旬）"],
      "researchIds": ["RSH.STAR.VOID_STAR_SCHOOL"],
      "externalObservation": "截空有『正空/傍空』之分，旬空有『旬中空亡』與『截路空亡』並用者；各軟體僅取其一或全列。",
      "gap": "無 variant；目前未區分正空/傍空。",
      "nextAction": "先研究正空/傍空之可引用來源，再以 variant 擴充。",
      "ownerReviewRequired": true
    },
    {
      "dimensionId": "VAR.KUIYUE",
      "name": { "zh-TW": "天魁天鉞", "en": "Kui Yue placement profile" },
      "status": "partially-modeled",
      "mechanism": "rule-variant",
      "profileFields": [],
      "profiles": ["school-ma-hu"],
      "rules": ["ZW.CALC.STAR.YEARSTEM_AUX.001"],
      "variants": ["ZW.CALC.STAR.YEARSTEM_AUX.V001"],
      "coveredBy": ["variant patch: 天鉞 辛干 → 午"],
      "researchIds": ["RSH.STAR.KUIYUE_SCHOOL"],
      "externalObservation": "魁鉞差異集中在辛干（午/寅之別）。",
      "gap": "僅辛干單點差異，其他天干若有流派差異未涵蓋。",
      "nextAction": "如有其他天干差異來源，再擴充同一 variant 的 patch。",
      "ownerReviewRequired": false
    },
    {
      "dimensionId": "VAR.TIANSHI_TIANSHANG",
      "name": { "zh-TW": "天傷天使", "en": "Tian Shang / Tian Shi profile" },
      "status": "partially-modeled",
      "mechanism": "none",
      "profileFields": [],
      "profiles": [],
      "rules": ["ZW.CALC.STAR.FIXED.001"],
      "variants": [],
      "coveredBy": ["天傷固定守交友宮、天使固定守疾厄宮（全書卷二安天傷天使訣）"],
      "researchIds": ["RSH.STAR.TIANSHI_TIANSHANG"],
      "externalObservation": "《全書》訣作『命前六位是天傷，命後六位是天使』，本引擎以固定宮位（交友/疾厄）實作；兩者於命宮起例下等價，但若命身宮定位不同則可能分歧。",
      "gap": "以固定宮位實作而非依命宮位移，遇到採不同命宮起例之流派可能不一致。",
      "nextAction": "以命前六位/命後六位重新驗證並在必要時改為位移實作（需 Owner 決定是否變更 canonical）。",
      "ownerReviewRequired": true
    },
    {
      "dimensionId": "VAR.CHANGSHENG",
      "name": { "zh-TW": "長生十二神", "en": "Chang Sheng profile" },
      "status": "partially-modeled",
      "mechanism": "profile-field",
      "profileFields": ["ruleOverrides"],
      "profiles": ["canonical"],
      "rules": ["ZW.CALC.STAR.CHANGSHENG12.001"],
      "variants": [],
      "coveredBy": ["五行局起長生（水申/木亥/金巳/土申/火寅）與《全書》卷二相符"],
      "researchIds": ["RSH.STAR.CHANGSHENG_DIRECTION"],
      "externalObservation": "《全書》卷二作『男命順數、女命逆數』（不論陰陽）；本引擎 canonical 採『陽男陰女順、陰男陽女逆』。兩者僅在陰男/陽女時相反。",
      "gap": "方向基準（性別 vs 陰陽）存在流派衝突，現行 canonical 未以 variant 表達《全書》原文法。",
      "nextAction": "登錄 RSH.STAR.CHANGSHENG_DIRECTION；若 Owner 認可，新增 variant 規則（男順女逆）並指定 profile，不得直接改 canonical。",
      "ownerReviewRequired": true
    },
    {
      "dimensionId": "VAR.MINOR_PERIOD",
      "name": { "zh-TW": "小限", "en": "Minor period policy" },
      "status": "partially-modeled",
      "mechanism": "none",
      "profileFields": [],
      "profiles": [],
      "rules": ["ZW.CALC.PERIOD.XIAOXIAN.001"],
      "variants": [],
      "coveredBy": ["canonical：不論陰陽、男順女逆（依《全書》卷二安小限訣，2026-09-24 Owner 批准）"],
      "researchIds": ["RSH.PERIOD.XIAOXIAN_DIRECTION"],
      "externalObservation": "部分現代排盤以小限同大限之陰陽順逆（陰男陽女逆行），與《全書》原文『不論陰陽』不同。",
      "gap": "「陰男陽女逆行」版本尚未以 variant 表達。",
      "nextAction": "若 Owner 決定支援，新增可切換 variant（以 profile 指定），canonical 維持原文法。",
      "ownerReviewRequired": true
    },
    {
      "dimensionId": "VAR.YEAR_DEITY_SCOPE",
      "name": { "zh-TW": "十二神 Scope（歲建/將前）", "en": "Year deity scope policy" },
      "status": "not-modeled",
      "mechanism": "none",
      "profileFields": [],
      "profiles": [],
      "rules": ["ZW.CALC.STAR.YEARBRANCH_AUX.001"],
      "variants": [],
      "coveredBy": ["歲建/將前目前僅以年 scope 安放（natal 盤）", "tables/cycles/{suiqian,jiangqian}.json"],
      "researchIds": ["RSH.PERIOD.YEAR_DEITY_SCOPE"],
      "externalObservation": "部分軟體對大限/流年/流月/流日/流時各層重新安歲前、將前十二神。",
      "gap": "「各限層重新安十二神」尚未建模；現僅年 scope。",